trtexec/mnist/trt_build_best.log
[01/01/2022-16:13:45] [V] [TRT] *************** Autotuning Reformat: Float(784,784,28,1) -> Float(784,1,28,1) ***************
[01/01/2022-16:13:45] [V] [TRT] --------------- Timing Runner: Optimizer Reformat(Input3 -> <out>) (Reformat)
[01/01/2022-16:13:45] [V] [TRT] Setting a default quantization params because quantization data is missing for 
[01/01/2022-16:13:45] [V] [TRT] Tactic: 0x00000000000003e8 Time: 0.00595619
[01/01/2022-16:13:45] [V] [TRT] Setting a default quantization params because quantization data is missing for 
[01/01/2022-16:13:45] [V] [TRT] Tactic: 0x00000000000003ea Time: 0.116864
[01/01/2022-16:13:45] [V] [TRT] Setting a default quantization params because quantization data is missing for 
[01/01/2022-16:13:45] [V] [TRT] Tactic: 0x0000000000000000 Time: 0.00633938
[01/01/2022-16:13:45] [V] [TRT] Fastest Tactic: 0x00000000000003e8 Time: 0.00595619
[01/01/2022-16:13:45] [V] [TRT] *************** Autotuning Reformat: Float(784,784,28,1) -> Float(784,1:4,28,1) ***************
[01/01/2022-16:13:45] [V] [TRT] --------------- Timing Runner: Optimizer Reformat(Input3 -> <out>) (Reformat)
[01/01/2022-16:13:45] [V] [TRT] Setting a default quantization params because quantization data is missing for 
[01/01/2022-16:13:45] [V] [TRT] Tactic: 0x00000000000003e8 Time: 0.00640934
[01/01/2022-16:13:45] [V] [TRT] Setting a default quantization params because quantization data is missing for 
[01/01/2022-16:13:45] [V] [TRT] Tactic: 0x00000000000003ea Time: 0.0149349
[01/01/2022-16:13:45] [V] [TRT] Setting a default quantization params because quantization data is missing for 
[01/01/2022-16:13:45] [V] [TRT] Tactic: 0x0000000000000000 Time: 0.00562567
[01/01/2022-16:13:45] [V] [TRT] Fastest Tactic: 0x0000000000000000 Time: 0.00562567
[01/01/2022-16:13:45] [V] [TRT] *************** Autotuning Reformat: Float(784,784,28,1) -> Half(784,784,28,1) ***************
[01/01/2022-16:13:45] [V] [TRT] --------------- Timing Runner: Optimizer Reformat(Input3 -> <out>) (Reformat)
[01/01/2022-16:13:45] [V] [TRT] Setting a default quantization params because quantization data is missing for 
[01/01/2022-16:13:45] [V] [TRT] Tactic: 0x00000000000003e8 Time: 0.00488929
[01/01/2022-16:13:45] [V] [TRT] Setting a default quantization params because quantization data is missing for 
[01/01/2022-16:13:45] [V] [TRT] Tactic: 0x00000000000003ea Time: 0.0131782
[01/01/2022-16:13:45] [V] [TRT] Setting a default quantization params because quantization data is missing for 
[01/01/2022-16:13:45] [V] [TRT] Tactic: 0x0000000000000000 Time: 0.00531837
[01/01/2022-16:13:45] [V] [TRT] Fastest Tactic: 0x00000000000003e8 Time: 0.00488929
[01/01/2022-16:13:45] [V] [TRT] *************** Autotuning Reformat: Float(784,784,28,1) -> Half(784,784:2,28,1) ***************
[01/01/2022-16:13:45] [V] [TRT] --------------- Timing Runner: Optimizer Reformat(Input3 -> <out>) (Reformat)
[01/01/2022-16:13:45] [V] [TRT] Setting a default quantization params because quantization data is missing for 
[01/01/2022-16:13:45] [V] [TRT] Tactic: 0x00000000000003e8 Time: 0.00531454
[01/01/2022-16:13:45] [V] [TRT] Setting a default quantization params because quantization data is missing for 
[01/01/2022-16:13:45] [V] [TRT] Tactic: 0x00000000000003ea Time: 0.0137708
[01/01/2022-16:13:45] [V] [TRT] Setting a default quantization params because quantization data is missing for 
[01/01/2022-16:13:45] [V] [TRT] Tactic: 0x0000000000000000 Time: 0.00462348
[01/01/2022-16:13:45] [V] [TRT] Fastest Tactic: 0x0000000000000000 Time: 0.00462348
[01/01/2022-16:13:45] [V] [TRT] *************** Autotuning Reformat: Float(784,784,28,1) -> Half(784,1:4,28,1) ***************
[01/01/2022-16:13:45] [V] [TRT] --------------- Timing Runner: Optimizer Reformat(Input3 -> <out>) (Reformat)
[01/01/2022-16:13:45] [V] [TRT] Setting a default quantization params because quantization data is missing for 
[01/01/2022-16:13:45] [V] [TRT] Tactic: 0x00000000000003e8 Time: 0.00536872
[01/01/2022-16:13:45] [V] [TRT] Setting a default quantization params because quantization data is missing for 
[01/01/2022-16:13:45] [V] [TRT] Tactic: 0x00000000000003ea Time: 0.0135352
[01/01/2022-16:13:45] [V] [TRT] Setting a default quantization params because quantization data is missing for 
[01/01/2022-16:13:45] [V] [TRT] Tactic: 0x0000000000000000 Time: 0.00512196
[01/01/2022-16:13:45] [V] [TRT] Fastest Tactic: 0x0000000000000000 Time: 0.00512196
[01/01/2022-16:13:45] [V] [TRT] *************** Autotuning Reformat: Float(784,784,28,1) -> Half(784,1:8,28,1) ***************
[01/01/2022-16:13:45] [V] [TRT] --------------- Timing Runner: Optimizer Reformat(Input3 -> <out>) (Reformat)
[01/01/2022-16:13:45] [V] [TRT] Setting a default quantization params because quantization data is missing for 
[01/01/2022-16:13:45] [V] [TRT] Tactic: 0x00000000000003e8 Time: 0.00496646
[01/01/2022-16:13:45] [V] [TRT] Setting a default quantization params because quantization data is missing for 
[01/01/2022-16:13:45] [V] [TRT] Tactic: 0x00000000000003ea Time: 0.0133689
[01/01/2022-16:13:45] [V] [TRT] Setting a default quantization params because quantization data is missing for 
[01/01/2022-16:13:45] [V] [TRT] Tactic: 0x0000000000000000 Time: 0.00483352
[01/01/2022-16:13:45] [V] [TRT] Fastest Tactic: 0x0000000000000000 Time: 0.00483352
[01/01/2022-16:13:45] [V] [TRT] *************** Autotuning Reformat: Float(784,784,28,1) -> Half(784,784:32,28,1) ***************
[01/01/2022-16:13:45] [V] [TRT] --------------- Timing Runner: Optimizer Reformat(Input3 -> <out>) (Reformat)
[01/01/2022-16:13:45] [V] [TRT] Setting a default quantization params because quantization data is missing for 
[01/01/2022-16:13:45] [V] [TRT] Tactic: 0x00000000000003e8 Time: 0.0117876
[01/01/2022-16:13:45] [V] [TRT] Setting a default quantization params because quantization data is missing for 
[01/01/2022-16:13:45] [V] [TRT] Tactic: 0x00000000000003ea Time: 0.0138722
[01/01/2022-16:13:45] [V] [TRT] Setting a default quantization params because quantization data is missing for 
[01/01/2022-16:13:45] [V] [TRT] Tactic: 0x0000000000000000 Time: 0.0117996
[01/01/2022-16:13:45] [V] [TRT] Fastest Tactic: 0x00000000000003e8 Time: 0.0117876
[01/01/2022-16:13:45] [V] [TRT] *************** Autotuning Reformat: Float(784,784,28,1) -> Int8(784,784,28,1) ***************
[01/01/2022-16:13:45] [V] [TRT] --------------- Timing Runner: Optimizer Reformat(Input3 -> <out>) (Reformat)
[01/01/2022-16:13:45] [V] [TRT] Setting a default quantization params because quantization data is missing for 
[01/01/2022-16:13:45] [V] [TRT] Tactic: 0x00000000000003e8 Time: 0.00506341
[01/01/2022-16:13:45] [V] [TRT] Setting a default quantization params because quantization data is missing for 
[01/01/2022-16:13:45] [V] [TRT] Tactic: 0x00000000000003ea Time: 0.013994
[01/01/2022-16:13:45] [V] [TRT] Setting a default quantization params because quantization data is missing for 
[01/01/2022-16:13:45] [V] [TRT] Tactic: 0x0000000000000000 Time: 0.00540292
[01/01/2022-16:13:45] [V] [TRT] Fastest Tactic: 0x00000000000003e8 Time: 0.00506341
[01/01/2022-16:13:45] [V] [TRT] *************** Autotuning Reformat: Float(784,784,28,1) -> Int8(784,784:4,28,1) ***************
[01/01/2022-16:13:45] [V] [TRT] --------------- Timing Runner: Optimizer Reformat(Input3 -> <out>) (Reformat)
[01/01/2022-16:13:45] [V] [TRT] Setting a default quantization params because quantization data is missing for 
[01/01/2022-16:13:45] [V] [TRT] Tactic: 0x00000000000003e8 Time: 0.00509809
[01/01/2022-16:13:45] [V] [TRT] Setting a default quantization params because quantization data is missing for 
[01/01/2022-16:13:45] [V] [TRT] Tactic: 0x00000000000003ea Time: 0.013302
[01/01/2022-16:13:45] [V] [TRT] Setting a default quantization params because quantization data is missing for 
[01/01/2022-16:13:45] [V] [TRT] Tactic: 0x0000000000000000 Time: 0.0049704
[01/01/2022-16:13:45] [V] [TRT] Fastest Tactic: 0x0000000000000000 Time: 0.0049704
[01/01/2022-16:13:45] [V] [TRT] *************** Autotuning Reformat: Float(784,784,28,1) -> Int8(784,784:32,28,1) ***************
[01/01/2022-16:13:45] [V] [TRT] --------------- Timing Runner: Optimizer Reformat(Input3 -> <out>) (Reformat)
[01/01/2022-16:13:45] [V] [TRT] Setting a default quantization params because quantization data is missing for 
[01/01/2022-16:13:45] [V] [TRT] Tactic: 0x00000000000003e8 Time: 0.00769684
[01/01/2022-16:13:45] [V] [TRT] Setting a default quantization params because quantization data is missing for 
[01/01/2022-16:13:45] [V] [TRT] Tactic: 0x00000000000003ea Time: 0.0141444
[01/01/2022-16:13:45] [V] [TRT] Setting a default quantization params because quantization data is missing for 
[01/01/2022-16:13:45] [V] [TRT] Tactic: 0x0000000000000000 Time: 0.00778875
[01/01/2022-16:13:45] [V] [TRT] Fastest Tactic: 0x00000000000003e8 Time: 0.00769684
[01/01/2022-16:13:45] [V] [TRT] =============== Computing reformatting costs: 
[01/01/2022-16:13:45] [V] [TRT] *************** Autotuning Reformat: Float(6272,784,28,1) -> Float(1568,1:4,56,2) ***************
[01/01/2022-16:13:45] [V] [TRT] --------------- Timing Runner: Optimizer Reformat(ReLU32_Output_0 -> <out>) (Reformat)
[01/01/2022-16:13:45] [V] [TRT] Setting a default quantization params because quantization data is missing for 
[01/01/2022-16:13:45] [V] [TRT] Tactic: 0x00000000000003e8 Time: 0.00503992
[01/01/2022-16:13:45] [V] [TRT] Setting a default quantization params because quantization data is missing for 
[01/01/2022-16:13:45] [V] [TRT] Tactic: 0x00000000000003ea Time: 0.012939
[01/01/2022-16:13:45] [V] [TRT] Setting a default quantization params because quantization data is missing for 
[01/01/2022-16:13:45] [V] [TRT] Tactic: 0x0000000000000000 Time: 0.00518792
[01/01/2022-16:13:45] [V] [TRT] Fastest Tactic: 0x00000000000003e8 Time: 0.00503992
[01/01/2022-16:13:45] [V] [TRT] *************** Autotuning Reformat: Float(6272,784,28,1) -> Half(6272,784,28,1) ***************
[01/01/2022-16:13:45] [V] [TRT] --------------- Timing Runner: Optimizer Reformat(ReLU32_Output_0 -> <out>) (Reformat)
[01/01/2022-16:13:45] [V] [TRT] Setting a default quantization params because quantization data is missing for 
[01/01/2022-16:13:45] [V] [TRT] Tactic: 0x00000000000003e8 Time: 0.00500571
[01/01/2022-16:13:45] [V] [TRT] Setting a default quantization params because quantization data is missing for 
[01/01/2022-16:13:45] [V] [TRT] Tactic: 0x00000000000003ea Time: 0.0124301
[01/01/2022-16:13:45] [V] [TRT] Setting a default quantization params because quantization data is missing for 
[01/01/2022-16:13:45] [V] [TRT] Tactic: 0x0000000000000000 Time: 0.00506041
[01/01/2022-16:13:45] [V] [TRT] Fastest Tactic: 0x00000000000003e8 Time: 0.00500571
[01/01/2022-16:13:45] [V] [TRT] *************** Autotuning Reformat: Float(6272,784,28,1) -> Half(3136,784:2,28,1) ***************
[01/01/2022-16:13:45] [V] [TRT] --------------- Timing Runner: Optimizer Reformat(ReLU32_Output_0 -> <out>) (Reformat)
[01/01/2022-16:13:45] [V] [TRT] Setting a default quantization params because quantization data is missing for 
[01/01/2022-16:13:45] [V] [TRT] Tactic: 0x00000000000003e8 Time: 0.0049362
[01/01/2022-16:13:45] [V] [TRT] Setting a default quantization params because quantization data is missing for 
[01/01/2022-16:13:45] [V] [TRT] Tactic: 0x00000000000003ea Time: 0.0127112
[01/01/2022-16:13:45] [V] [TRT] Setting a default quantization params because quantization data is missing for 
[01/01/2022-16:13:45] [V] [TRT] Tactic: 0x0000000000000000 Time: 0.00454629
[01/01/2022-16:13:45] [V] [TRT] Fastest Tactic: 0x0000000000000000 Time: 0.00454629
[01/01/2022-16:13:45] [V] [TRT] *************** Autotuning Reformat: Float(6272,784,28,1) -> Half(784,1:8,28,1) ***************
[01/01/2022-16:13:45] [V] [TRT] --------------- Timing Runner: Optimizer Reformat(ReLU32_Output_0 -> <out>) (Reformat)
[01/01/2022-16:13:45] [V] [TRT] Setting a default quantization params because quantization data is missing for 
[01/01/2022-16:13:45] [V] [TRT] Tactic: 0x00000000000003e8 Time: 0.00496189
[01/01/2022-16:13:45] [V] [TRT] Setting a default quantization params because quantization data is missing for 
[01/01/2022-16:13:45] [V] [TRT] Tactic: 0x00000000000003ea Time: 0.0123592
[01/01/2022-16:13:45] [V] [TRT] Setting a default quantization params because quantization data is missing for 
[01/01/2022-16:13:45] [V] [TRT] Tactic: 0x0000000000000000 Time: 0.00461921
[01/01/2022-16:13:45] [V] [TRT] Fastest Tactic: 0x0000000000000000 Time: 0.00461921
[01/01/2022-16:13:45] [V] [TRT] *************** Autotuning Reformat: Float(6272,784,28,1) -> Int8(1568,784:4,28,1) ***************
[01/01/2022-16:13:45] [V] [TRT] --------------- Timing Runner: Optimizer Reformat(ReLU32_Output_0 -> <out>) (Reformat)
[01/01/2022-16:13:45] [V] [TRT] Setting a default quantization params because quantization data is missing for 
[01/01/2022-16:13:45] [V] [TRT] Tactic: 0x00000000000003e8 Time: 0.00514057
[01/01/2022-16:13:45] [V] [TRT] Setting a default quantization params because quantization data is missing for 
[01/01/2022-16:13:45] [V] [TRT] Tactic: 0x00000000000003ea Time: 0.0127032
[01/01/2022-16:13:45] [V] [TRT] Setting a default quantization params because quantization data is missing for 
[01/01/2022-16:13:45] [V] [TRT] Tactic: 0x0000000000000000 Time: 0.00480686
[01/01/2022-16:13:45] [V] [TRT] Fastest Tactic: 0x0000000000000000 Time: 0.00480686
[01/01/2022-16:13:45] [V] [TRT] *************** Autotuning Reformat: Float(6272,784,28,1) -> Int8(784,784:32,28,1) ***************
[01/01/2022-16:13:45] [V] [TRT] --------------- Timing Runner: Optimizer Reformat(ReLU32_Output_0 -> <out>) (Reformat)
[01/01/2022-16:13:45] [V] [TRT] Setting a default quantization params because quantization data is missing for 
[01/01/2022-16:13:45] [V] [TRT] Tactic: 0x00000000000003e8 Time: 0.00765714
[01/01/2022-16:13:45] [V] [TRT] Setting a default quantization params because quantization data is missing for 
[01/01/2022-16:13:45] [V] [TRT] Tactic: 0x00000000000003ea Time: 0.0125787
[01/01/2022-16:13:45] [V] [TRT] Setting a default quantization params because quantization data is missing for 
[01/01/2022-16:13:45] [V] [TRT] Tactic: 0x0000000000000000 Time: 0.0079454
[01/01/2022-16:13:45] [V] [TRT] Fastest Tactic: 0x00000000000003e8 Time: 0.00765714
[01/01/2022-16:13:45] [V] [TRT] *************** Autotuning Reformat: Float(6272,1,224,8) -> Float(6272,784,28,1) ***************
[01/01/2022-16:13:45] [V] [TRT] --------------- Timing Runner: Optimizer Reformat(ReLU32_Output_0 -> <out>) (Reformat)
[01/01/2022-16:13:45] [V] [TRT] Setting a default quantization params because quantization data is missing for 
[01/01/2022-16:13:45] [V] [TRT] Tactic: 0x00000000000003e8 Time: 0.00517322
[01/01/2022-16:13:45] [V] [TRT] Setting a default quantization params because quantization data is missing for 
[01/01/2022-16:13:45] [V] [TRT] Tactic: 0x00000000000003ea Time: 0.0132168
[01/01/2022-16:13:45] [V] [TRT] Setting a default quantization params because quantization data is missing for 
[01/01/2022-16:13:45] [V] [TRT] Tactic: 0x0000000000000000 Time: 0.00519233
[01/01/2022-16:13:45] [V] [TRT] Fastest Tactic: 0x00000000000003e8 Time: 0.00517322
[01/01/2022-16:13:45] [V] [TRT] *************** Autotuning Reformat: Float(6272,1,224,8) -> Float(1568,1:4,56,2) ***************
[01/01/2022-16:13:45] [V] [TRT] --------------- Timing Runner: Optimizer Reformat(ReLU32_Output_0 -> <out>) (Reformat)
[01/01/2022-16:13:45] [V] [TRT] Setting a default quantization params because quantization data is missing for 
[01/01/2022-16:13:45] [V] [TRT] Tactic: 0x00000000000003e8 Time: 0.00512131
[01/01/2022-16:13:45] [V] [TRT] Setting a default quantization params because quantization data is missing for 
[01/01/2022-16:13:45] [V] [TRT] Tactic: 0x00000000000003ea Time: 0.0133561
[01/01/2022-16:13:45] [V] [TRT] Setting a default quantization params because quantization data is missing for 
[01/01/2022-16:13:45] [V] [TRT] Tactic: 0x0000000000000000 Time: 0.00521682
[01/01/2022-16:13:45] [V] [TRT] Fastest Tactic: 0x00000000000003e8 Time: 0.00512131
[01/01/2022-16:13:45] [V] [TRT] *************** Autotuning Reformat: Float(6272,1,224,8) -> Half(6272,784,28,1) ***************
[01/01/2022-16:13:45] [V] [TRT] --------------- Timing Runner: Optimizer Reformat(ReLU32_Output_0 -> <out>) (Reformat)
[01/01/2022-16:13:45] [V] [TRT] Setting a default quantization params because quantization data is missing for 
[01/01/2022-16:13:45] [V] [TRT] Tactic: 0x00000000000003e8 Time: 0.0053032
[01/01/2022-16:13:45] [V] [TRT] Setting a default quantization params because quantization data is missing for 
[01/01/2022-16:13:45] [V] [TRT] Tactic: 0x00000000000003ea Time: 0.012661
[01/01/2022-16:13:45] [V] [TRT] Setting a default quantization params because quantization data is missing for 
[01/01/2022-16:13:45] [V] [TRT] Tactic: 0x0000000000000000 Time: 0.00563305
[01/01/2022-16:13:45] [V] [TRT] Fastest Tactic: 0x00000000000003e8 Time: 0.0053032
[01/01/2022-16:13:45] [V] [TRT] *************** Autotuning Reformat: Float(6272,1,224,8) -> Half(3136,784:2,28,1) ***************
[01/01/2022-16:13:45] [V] [TRT] --------------- Timing Runner: Optimizer Reformat(ReLU32_Output_0 -> <out>) (Reformat)
[01/01/2022-16:13:45] [V] [TRT] Setting a default quantization params because quantization data is missing for 
[01/01/2022-16:13:45] [V] [TRT] Tactic: 0x00000000000003e8 Time: 0.00531037
[01/01/2022-16:13:45] [V] [TRT] Setting a default quantization params because quantization data is missing for 
[01/01/2022-16:13:45] [V] [TRT] Tactic: 0x00000000000003ea Time: 0.0121253
[01/01/2022-16:13:45] [V] [TRT] Setting a default quantization params because quantization data is missing for 
[01/01/2022-16:13:45] [V] [TRT] Tactic: 0x0000000000000000 Time: 0.00523494
[01/01/2022-16:13:45] [V] [TRT] Fastest Tactic: 0x0000000000000000 Time: 0.00523494
[01/01/2022-16:13:45] [V] [TRT] *************** Autotuning Reformat: Float(6272,1,224,8) -> Half(784,1:8,28,1) ***************
[01/01/2022-16:13:45] [V] [TRT] --------------- Timing Runner: Optimizer Reformat(ReLU32_Output_0 -> <out>) (Reformat)
[01/01/2022-16:13:45] [V] [TRT] Setting a default quantization params because quantization data is missing for 
[01/01/2022-16:13:45] [V] [TRT] Tactic: 0x00000000000003e8 Time: 0.00495275
[01/01/2022-16:13:45] [V] [TRT] Setting a default quantization params because quantization data is missing for 
[01/01/2022-16:13:45] [V] [TRT] Tactic: 0x00000000000003ea Time: 0.0123962
[01/01/2022-16:13:45] [V] [TRT] Setting a default quantization params because quantization data is missing for 
[01/01/2022-16:13:45] [V] [TRT] Tactic: 0x0000000000000000 Time: 0.00503661
[01/01/2022-16:13:45] [V] [TRT] Fastest Tactic: 0x00000000000003e8 Time: 0.00495275
[01/01/2022-16:13:45] [V] [TRT] *************** Autotuning Reformat: Float(6272,1,224,8) -> Int8(1568,784:4,28,1) ***************
[01/01/2022-16:13:45] [V] [TRT] --------------- Timing Runner: Optimizer Reformat(ReLU32_Output_0 -> <out>) (Reformat)
[01/01/2022-16:13:45] [V] [TRT] Setting a default quantization params because quantization data is missing for 
[01/01/2022-16:13:45] [V] [TRT] Tactic: 0x00000000000003e8 Time: 0.00554057
[01/01/2022-16:13:45] [V] [TRT] Setting a default quantization params because quantization data is missing for 
[01/01/2022-16:13:46] [V] [TRT] Tactic: 0x00000000000003ea Time: 0.0126206
[01/01/2022-16:13:46] [V] [TRT] Setting a default quantization params because quantization data is missing for 
[01/01/2022-16:13:46] [V] [TRT] Tactic: 0x0000000000000000 Time: 0.00547268
[01/01/2022-16:13:46] [V] [TRT] Fastest Tactic: 0x0000000000000000 Time: 0.00547268
[01/01/2022-16:13:46] [V] [TRT] *************** Autotuning Reformat: Float(6272,1,224,8) -> Int8(784,784:32,28,1) ***************
[01/01/2022-16:13:46] [V] [TRT] --------------- Timing Runner: Optimizer Reformat(ReLU32_Output_0 -> <out>) (Reformat)
[01/01/2022-16:13:46] [V] [TRT] Setting a default quantization params because quantization data is missing for 
[01/01/2022-16:13:46] [V] [TRT] Tactic: 0x00000000000003e8 Time: 0.00774544
[01/01/2022-16:13:46] [V] [TRT] Setting a default quantization params because quantization data is missing for 
[01/01/2022-16:13:46] [V] [TRT] Tactic: 0x00000000000003ea Time: 0.0126975
[01/01/2022-16:13:46] [V] [TRT] Setting a default quantization params because quantization data is missing for 
[01/01/2022-16:13:46] [V] [TRT] Tactic: 0x0000000000000000 Time: 0.00780102
[01/01/2022-16:13:46] [V] [TRT] Fastest Tactic: 0x00000000000003e8 Time: 0.00774544
[01/01/2022-16:13:46] [V] [TRT] *************** Autotuning Reformat: Float(1568,1:4,56,2) -> Float(6272,784,28,1) ***************
[01/01/2022-16:13:46] [V] [TRT] --------------- Timing Runner: Optimizer Reformat(ReLU32_Output_0 -> <out>) (Reformat)
[01/01/2022-16:13:46] [V] [TRT] Setting a default quantization params because quantization data is missing for 
[01/01/2022-16:13:46] [V] [TRT] Tactic: 0x00000000000003e8 Time: 0.00535941
[01/01/2022-16:13:46] [V] [TRT] Setting a default quantization params because quantization data is missing for 
[01/01/2022-16:13:46] [V] [TRT] Tactic: 0x00000000000003ea Time: 0.0128263
[01/01/2022-16:13:46] [V] [TRT] Setting a default quantization params because quantization data is missing for 
[01/01/2022-16:13:46] [V] [TRT] Tactic: 0x0000000000000000 Time: 0.00535856
[01/01/2022-16:13:46] [V] [TRT] Fastest Tactic: 0x0000000000000000 Time: 0.00535856
[01/01/2022-16:13:46] [V] [TRT] *************** Autotuning Reformat: Float(1568,1:4,56,2) -> Half(6272,784,28,1) ***************
[01/01/2022-16:13:46] [V] [TRT] --------------- Timing Runner: Optimizer Reformat(ReLU32_Output_0 -> <out>) (Reformat)
[01/01/2022-16:13:46] [V] [TRT] Setting a default quantization params because quantization data is missing for 
[01/01/2022-16:13:46] [V] [TRT] Tactic: 0x00000000000003e8 Time: 0.00528702
[01/01/2022-16:13:46] [V] [TRT] Setting a default quantization params because quantization data is missing for 
[01/01/2022-16:13:46] [V] [TRT] Tactic: 0x00000000000003ea Time: 0.013174
[01/01/2022-16:13:46] [V] [TRT] Setting a default quantization params because quantization data is missing for 
[01/01/2022-16:13:46] [V] [TRT] Tactic: 0x0000000000000000 Time: 0.00544559
[01/01/2022-16:13:46] [V] [TRT] Fastest Tactic: 0x00000000000003e8 Time: 0.00528702
[01/01/2022-16:13:46] [V] [TRT] *************** Autotuning Reformat: Float(1568,1:4,56,2) -> Half(3136,784:2,28,1) ***************
[01/01/2022-16:13:46] [V] [TRT] --------------- Timing Runner: Optimizer Reformat(ReLU32_Output_0 -> <out>) (Reformat)
[01/01/2022-16:13:46] [V] [TRT] Setting a default quantization params because quantization data is missing for 
[01/01/2022-16:13:46] [V] [TRT] Tactic: 0x00000000000003e8 Time: 0.00507523
[01/01/2022-16:13:46] [V] [TRT] Setting a default quantization params because quantization data is missing for 
[01/01/2022-16:13:46] [V] [TRT] Tactic: 0x00000000000003ea Time: 0.0127432
[01/01/2022-16:13:46] [V] [TRT] Setting a default quantization params because quantization data is missing for 
[01/01/2022-16:13:46] [V] [TRT] Tactic: 0x0000000000000000 Time: 0.00523298
[01/01/2022-16:13:46] [V] [TRT] Fastest Tactic: 0x00000000000003e8 Time: 0.00507523
[01/01/2022-16:13:46] [V] [TRT] *************** Autotuning Reformat: Float(1568,1:4,56,2) -> Half(784,1:8,28,1) ***************
[01/01/2022-16:13:46] [V] [TRT] --------------- Timing Runner: Optimizer Reformat(ReLU32_Output_0 -> <out>) (Reformat)
[01/01/2022-16:13:46] [V] [TRT] Setting a default quantization params because quantization data is missing for 
[01/01/2022-16:13:46] [V] [TRT] Tactic: 0x00000000000003e8 Time: 0.00519992
[01/01/2022-16:13:46] [V] [TRT] Setting a default quantization params because quantization data is missing for 
[01/01/2022-16:13:46] [V] [TRT] Tactic: 0x00000000000003ea Time: 0.0127421
[01/01/2022-16:13:46] [V] [TRT] Setting a default quantization params because quantization data is missing for 
[01/01/2022-16:13:46] [V] [TRT] Tactic: 0x0000000000000000 Time: 0.00536703
[01/01/2022-16:13:46] [V] [TRT] Fastest Tactic: 0x00000000000003e8 Time: 0.00519992
[01/01/2022-16:13:46] [V] [TRT] *************** Autotuning Reformat: Float(1568,1:4,56,2) -> Int8(1568,784:4,28,1) ***************
[01/01/2022-16:13:46] [V] [TRT] --------------- Timing Runner: Optimizer Reformat(ReLU32_Output_0 -> <out>) (Reformat)
[01/01/2022-16:13:46] [V] [TRT] Setting a default quantization params because quantization data is missing for 
[01/01/2022-16:13:46] [V] [TRT] Tactic: 0x00000000000003e8 Time: 0.00562215
[01/01/2022-16:13:46] [V] [TRT] Setting a default quantization params because quantization data is missing for 
[01/01/2022-16:13:46] [V] [TRT] Tactic: 0x00000000000003ea Time: 0.0138099
[01/01/2022-16:13:46] [V] [TRT] Setting a default quantization params because quantization data is missing for 
[01/01/2022-16:13:46] [V] [TRT] Tactic: 0x0000000000000000 Time: 0.00555675
[01/01/2022-16:13:46] [V] [TRT] Fastest Tactic: 0x0000000000000000 Time: 0.00555675
[01/01/2022-16:13:46] [V] [TRT] *************** Autotuning Reformat: Float(1568,1:4,56,2) -> Int8(784,784:32,28,1) ***************
[01/01/2022-16:13:46] [V] [TRT] --------------- Timing Runner: Optimizer Reformat(ReLU32_Output_0 -> <out>) (Reformat)
[01/01/2022-16:13:46] [V] [TRT] Setting a default quantization params because quantization data is missing for 
[01/01/2022-16:13:46] [V] [TRT] Tactic: 0x00000000000003e8 Time: 0.00781618
[01/01/2022-16:13:46] [V] [TRT] Setting a default quantization params because quantization data is missing for 
[01/01/2022-16:13:46] [V] [TRT] Tactic: 0x00000000000003ea Time: 0.0139404
[01/01/2022-16:13:46] [V] [TRT] Setting a default quantization params because quantization data is missing for 
[01/01/2022-16:13:46] [V] [TRT] Tactic: 0x0000000000000000 Time: 0.00806527
[01/01/2022-16:13:46] [V] [TRT] Fastest Tactic: 0x00000000000003e8 Time: 0.00781618
[01/01/2022-16:13:46] [V] [TRT] *************** Autotuning Reformat: Float(784,784:32,28,1) -> Float(6272,784,28,1) ***************
[01/01/2022-16:13:46] [V] [TRT] --------------- Timing Runner: Optimizer Reformat(ReLU32_Output_0 -> <out>) (Reformat)
[01/01/2022-16:13:46] [V] [TRT] Setting a default quantization params because quantization data is missing for 
[01/01/2022-16:13:46] [V] [TRT] Tactic: 0x00000000000003e8 Time: 0.00585454
[01/01/2022-16:13:46] [V] [TRT] Setting a default quantization params because quantization data is missing for 
[01/01/2022-16:13:46] [V] [TRT] Tactic: 0x00000000000003ea Time: 0.0130888
[01/01/2022-16:13:46] [V] [TRT] Setting a default quantization params because quantization data is missing for 
[01/01/2022-16:13:46] [V] [TRT] Tactic: 0x0000000000000000 Time: 0.00561952
[01/01/2022-16:13:46] [V] [TRT] Fastest Tactic: 0x0000000000000000 Time: 0.00561952
[01/01/2022-16:13:46] [V] [TRT] *************** Autotuning Reformat: Float(784,784:32,28,1) -> Float(1568,1:4,56,2) ***************
[01/01/2022-16:13:46] [V] [TRT] --------------- Timing Runner: Optimizer Reformat(ReLU32_Output_0 -> <out>) (Reformat)
[01/01/2022-16:13:46] [V] [TRT] Setting a default quantization params because quantization data is missing for 
[01/01/2022-16:13:46] [V] [TRT] Tactic: 0x00000000000003e8 Time: 0.00516098
[01/01/2022-16:13:46] [V] [TRT] Setting a default quantization params because quantization data is missing for 
[01/01/2022-16:13:46] [V] [TRT] Tactic: 0x00000000000003ea Time: 0.0141112
[01/01/2022-16:13:46] [V] [TRT] Setting a default quantization params because quantization data is missing for 
[01/01/2022-16:13:46] [V] [TRT] Tactic: 0x0000000000000000 Time: 0.00526253
[01/01/2022-16:13:46] [V] [TRT] Fastest Tactic: 0x00000000000003e8 Time: 0.00516098
[01/01/2022-16:13:46] [V] [TRT] *************** Autotuning Reformat: Float(784,784:32,28,1) -> Half(6272,784,28,1) ***************
[01/01/2022-16:13:46] [V] [TRT] --------------- Timing Runner: Optimizer Reformat(ReLU32_Output_0 -> <out>) (Reformat)
[01/01/2022-16:13:46] [V] [TRT] Setting a default quantization params because quantization data is missing for 
[01/01/2022-16:13:46] [V] [TRT] Tactic: 0x00000000000003e8 Time: 0.00581687
[01/01/2022-16:13:46] [V] [TRT] Setting a default quantization params because quantization data is missing for 
[01/01/2022-16:13:46] [V] [TRT] Tactic: 0x00000000000003ea Time: 0.0126644
[01/01/2022-16:13:46] [V] [TRT] Setting a default quantization params because quantization data is missing for 
[01/01/2022-16:13:46] [V] [TRT] Tactic: 0x0000000000000000 Time: 0.00576677
[01/01/2022-16:13:46] [V] [TRT] Fastest Tactic: 0x0000000000000000 Time: 0.00576677
[01/01/2022-16:13:46] [V] [TRT] *************** Autotuning Reformat: Float(784,784:32,28,1) -> Half(3136,784:2,28,1) ***************
[01/01/2022-16:13:46] [V] [TRT] --------------- Timing Runner: Optimizer Reformat(ReLU32_Output_0 -> <out>) (Reformat)
[01/01/2022-16:13:46] [V] [TRT] Setting a default quantization params because quantization data is missing for 
[01/01/2022-16:13:46] [V] [TRT] Tactic: 0x00000000000003e8 Time: 0.00575945
[01/01/2022-16:13:46] [V] [TRT] Setting a default quantization params because quantization data is missing for 
[01/01/2022-16:13:46] [V] [TRT] Tactic: 0x00000000000003ea Time: 0.0119131
[01/01/2022-16:13:46] [V] [TRT] Setting a default quantization params because quantization data is missing for 
[01/01/2022-16:13:46] [V] [TRT] Tactic: 0x0000000000000000 Time: 0.00573696
[01/01/2022-16:13:46] [V] [TRT] Fastest Tactic: 0x0000000000000000 Time: 0.00573696
[01/01/2022-16:13:46] [V] [TRT] *************** Autotuning Reformat: Float(784,784:32,28,1) -> Half(784,1:8,28,1) ***************
[01/01/2022-16:13:46] [V] [TRT] --------------- Timing Runner: Optimizer Reformat(ReLU32_Output_0 -> <out>) (Reformat)
[01/01/2022-16:13:46] [V] [TRT] Setting a default quantization params because quantization data is missing for 
[01/01/2022-16:13:46] [V] [TRT] Tactic: 0x00000000000003e8 Time: 0.00495464
[01/01/2022-16:13:46] [V] [TRT] Setting a default quantization params because quantization data is missing for 
[01/01/2022-16:13:46] [V] [TRT] Tactic: 0x00000000000003ea Time: 0.0122602
[01/01/2022-16:13:46] [V] [TRT] Setting a default quantization params because quantization data is missing for 
[01/01/2022-16:13:46] [V] [TRT] Tactic: 0x0000000000000000 Time: 0.00507318
[01/01/2022-16:13:46] [V] [TRT] Fastest Tactic: 0x00000000000003e8 Time: 0.00495464
[01/01/2022-16:13:46] [V] [TRT] *************** Autotuning Reformat: Float(784,784:32,28,1) -> Int8(1568,784:4,28,1) ***************
[01/01/2022-16:13:46] [V] [TRT] --------------- Timing Runner: Optimizer Reformat(ReLU32_Output_0 -> <out>) (Reformat)
[01/01/2022-16:13:46] [V] [TRT] Setting a default quantization params because quantization data is missing for 
[01/01/2022-16:13:46] [V] [TRT] Tactic: 0x00000000000003e8 Time: 0.00586423
[01/01/2022-16:13:46] [V] [TRT] Setting a default quantization params because quantization data is missing for 
[01/01/2022-16:13:46] [V] [TRT] Tactic: 0x00000000000003ea Time: 0.0127509
[01/01/2022-16:13:46] [V] [TRT] Setting a default quantization params because quantization data is missing for 
[01/01/2022-16:13:46] [V] [TRT] Tactic: 0x0000000000000000 Time: 0.00558189
[01/01/2022-16:13:46] [V] [TRT] Fastest Tactic: 0x0000000000000000 Time: 0.00558189
[01/01/2022-16:13:46] [V] [TRT] *************** Autotuning Reformat: Float(784,784:32,28,1) -> Int8(784,784:32,28,1) ***************
[01/01/2022-16:13:46] [V] [TRT] --------------- Timing Runner: Optimizer Reformat(ReLU32_Output_0 -> <out>) (Reformat)
[01/01/2022-16:13:46] [V] [TRT] Setting a default quantization params because quantization data is missing for 
[01/01/2022-16:13:46] [V] [TRT] Tactic: 0x00000000000003e8 Time: 0.0082687
[01/01/2022-16:13:46] [V] [TRT] Setting a default quantization params because quantization data is missing for 
[01/01/2022-16:13:46] [V] [TRT] Tactic: 0x00000000000003ea Time: 0.0126499
[01/01/2022-16:13:46] [V] [TRT] Setting a default quantization params because quantization data is missing for 
[01/01/2022-16:13:46] [V] [TRT] Tactic: 0x0000000000000000 Time: 0.00806451
[01/01/2022-16:13:46] [V] [TRT] Fastest Tactic: 0x0000000000000000 Time: 0.00806451
[01/01/2022-16:13:46] [V] [TRT] *************** Autotuning Reformat: Half(6272,784,28,1) -> Float(6272,784,28,1) ***************
[01/01/2022-16:13:46] [V] [TRT] --------------- Timing Runner: Optimizer Reformat(ReLU32_Output_0 -> <out>) (Reformat)
[01/01/2022-16:13:46] [V] [TRT] Setting a default quantization params because quantization data is missing for 
[01/01/2022-16:13:46] [V] [TRT] Tactic: 0x00000000000003e8 Time: 0.00483413
[01/01/2022-16:13:46] [V] [TRT] Setting a default quantization params because quantization data is missing for 
[01/01/2022-16:13:46] [V] [TRT] Tactic: 0x00000000000003ea Time: 0.012048
[01/01/2022-16:13:46] [V] [TRT] Setting a default quantization params because quantization data is missing for 
[01/01/2022-16:13:46] [V] [TRT] Tactic: 0x0000000000000000 Time: 0.00502952
[01/01/2022-16:13:46] [V] [TRT] Fastest Tactic: 0x00000000000003e8 Time: 0.00483413
[01/01/2022-16:13:46] [V] [TRT] *************** Autotuning Reformat: Half(6272,784,28,1) -> Float(1568,1:4,56,2) ***************
[01/01/2022-16:13:46] [V] [TRT] --------------- Timing Runner: Optimizer Reformat(ReLU32_Output_0 -> <out>) (Reformat)
[01/01/2022-16:13:46] [V] [TRT] Setting a default quantization params because quantization data is missing for 
[01/01/2022-16:13:46] [V] [TRT] Tactic: 0x00000000000003e8 Time: 0.00536076
[01/01/2022-16:13:46] [V] [TRT] Setting a default quantization params because quantization data is missing for 
[01/01/2022-16:13:46] [V] [TRT] Tactic: 0x00000000000003ea Time: 0.0128587
[01/01/2022-16:13:46] [V] [TRT] Setting a default quantization params because quantization data is missing for 
[01/01/2022-16:13:46] [V] [TRT] Tactic: 0x0000000000000000 Time: 0.00568804
[01/01/2022-16:13:46] [V] [TRT] Fastest Tactic: 0x00000000000003e8 Time: 0.00536076
[01/01/2022-16:13:46] [V] [TRT] *************** Autotuning Reformat: Half(6272,784,28,1) -> Half(3136,784:2,28,1) ***************
[01/01/2022-16:13:46] [V] [TRT] --------------- Timing Runner: Optimizer Reformat(ReLU32_Output_0 -> <out>) (Reformat)
[01/01/2022-16:13:46] [V] [TRT] Setting a default quantization params because quantization data is missing for 
[01/01/2022-16:13:46] [V] [TRT] Tactic: 0x00000000000003e8 Time: 0.00498191
[01/01/2022-16:13:46] [V] [TRT] Setting a default quantization params because quantization data is missing for 
[01/01/2022-16:13:46] [V] [TRT] Tactic: 0x00000000000003ea Time: 0.0129448
[01/01/2022-16:13:46] [V] [TRT] Setting a default quantization params because quantization data is missing for 
[01/01/2022-16:13:46] [V] [TRT] Tactic: 0x0000000000000000 Time: 0.00479665
[01/01/2022-16:13:46] [V] [TRT] Fastest Tactic: 0x0000000000000000 Time: 0.00479665
[01/01/2022-16:13:46] [V] [TRT] *************** Autotuning Reformat: Half(6272,784,28,1) -> Half(784,1:8,28,1) ***************
[01/01/2022-16:13:46] [V] [TRT] --------------- Timing Runner: Optimizer Reformat(ReLU32_Output_0 -> <out>) (Reformat)
[01/01/2022-16:13:46] [V] [TRT] Setting a default quantization params because quantization data is missing for 
[01/01/2022-16:13:46] [V] [TRT] Tactic: 0x00000000000003e8 Time: 0.00526286
[01/01/2022-16:13:46] [V] [TRT] Setting a default quantization params because quantization data is missing for 
[01/01/2022-16:13:46] [V] [TRT] Tactic: 0x00000000000003ea Time: 0.0127901
[01/01/2022-16:13:46] [V] [TRT] Setting a default quantization params because quantization data is missing for 
[01/01/2022-16:13:46] [V] [TRT] Tactic: 0x0000000000000000 Time: 0.00500808
[01/01/2022-16:13:46] [V] [TRT] Fastest Tactic: 0x0000000000000000 Time: 0.00500808
[01/01/2022-16:13:46] [V] [TRT] *************** Autotuning Reformat: Half(6272,784,28,1) -> Int8(1568,784:4,28,1) ***************
[01/01/2022-16:13:46] [V] [TRT] --------------- Timing Runner: Optimizer Reformat(ReLU32_Output_0 -> <out>) (Reformat)
[01/01/2022-16:13:46] [V] [TRT] Setting a default quantization params because quantization data is missing for 
[01/01/2022-16:13:46] [V] [TRT] Tactic: 0x00000000000003e8 Time: 0.00540377
[01/01/2022-16:13:46] [V] [TRT] Setting a default quantization params because quantization data is missing for 
[01/01/2022-16:13:46] [V] [TRT] Tactic: 0x00000000000003ea Time: 0.0131894
[01/01/2022-16:13:46] [V] [TRT] Setting a default quantization params because quantization data is missing for 
[01/01/2022-16:13:46] [V] [TRT] Tactic: 0x0000000000000000 Time: 0.00555921
[01/01/2022-16:13:46] [V] [TRT] Fastest Tactic: 0x00000000000003e8 Time: 0.00540377
[01/01/2022-16:13:46] [V] [TRT] *************** Autotuning Reformat: Half(6272,784,28,1) -> Int8(784,784:32,28,1) ***************
[01/01/2022-16:13:46] [V] [TRT] --------------- Timing Runner: Optimizer Reformat(ReLU32_Output_0 -> <out>) (Reformat)
[01/01/2022-16:13:46] [V] [TRT] Setting a default quantization params because quantization data is missing for 
[01/01/2022-16:13:46] [V] [TRT] Tactic: 0x00000000000003e8 Time: 0.00752626
[01/01/2022-16:13:46] [V] [TRT] Setting a default quantization params because quantization data is missing for 
[01/01/2022-16:13:46] [V] [TRT] Tactic: 0x00000000000003ea Time: 0.0133615
[01/01/2022-16:13:46] [V] [TRT] Setting a default quantization params because quantization data is missing for 
[01/01/2022-16:13:46] [V] [TRT] Tactic: 0x0000000000000000 Time: 0.00744846
[01/01/2022-16:13:46] [V] [TRT] Fastest Tactic: 0x0000000000000000 Time: 0.00744846
[01/01/2022-16:13:46] [V] [TRT] *************** Autotuning Reformat: Half(3136,784:2,28,1) -> Float(6272,784,28,1) ***************
[01/01/2022-16:13:46] [V] [TRT] --------------- Timing Runner: Optimizer Reformat(ReLU32_Output_0 -> <out>) (Reformat)
[01/01/2022-16:13:46] [V] [TRT] Setting a default quantization params because quantization data is missing for 
[01/01/2022-16:13:46] [V] [TRT] Tactic: 0x00000000000003e8 Time: 0.00491109
[01/01/2022-16:13:46] [V] [TRT] Setting a default quantization params because quantization data is missing for 
[01/01/2022-16:13:46] [V] [TRT] Tactic: 0x00000000000003ea Time: 0.0117725
[01/01/2022-16:13:46] [V] [TRT] Setting a default quantization params because quantization data is missing for 
[01/01/2022-16:13:46] [V] [TRT] Tactic: 0x0000000000000000 Time: 0.00446643
[01/01/2022-16:13:46] [V] [TRT] Fastest Tactic: 0x0000000000000000 Time: 0.00446643
[01/01/2022-16:13:46] [V] [TRT] *************** Autotuning Reformat: Half(3136,784:2,28,1) -> Float(1568,1:4,56,2) ***************
[01/01/2022-16:13:46] [V] [TRT] --------------- Timing Runner: Optimizer Reformat(ReLU32_Output_0 -> <out>) (Reformat)
[01/01/2022-16:13:46] [V] [TRT] Setting a default quantization params because quantization data is missing for 
[01/01/2022-16:13:46] [V] [TRT] Tactic: 0x00000000000003e8 Time: 0.00515216
[01/01/2022-16:13:46] [V] [TRT] Setting a default quantization params because quantization data is missing for 
[01/01/2022-16:13:46] [V] [TRT] Tactic: 0x00000000000003ea Time: 0.0122343
[01/01/2022-16:13:46] [V] [TRT] Setting a default quantization params because quantization data is missing for 
[01/01/2022-16:13:46] [V] [TRT] Tactic: 0x0000000000000000 Time: 0.0053076
[01/01/2022-16:13:46] [V] [TRT] Fastest Tactic: 0x00000000000003e8 Time: 0.00515216
[01/01/2022-16:13:46] [V] [TRT] *************** Autotuning Reformat: Half(3136,784:2,28,1) -> Half(6272,784,28,1) ***************
[01/01/2022-16:13:46] [V] [TRT] --------------- Timing Runner: Optimizer Reformat(ReLU32_Output_0 -> <out>) (Reformat)
[01/01/2022-16:13:46] [V] [TRT] Setting a default quantization params because quantization data is missing for 
[01/01/2022-16:13:46] [V] [TRT] Tactic: 0x00000000000003e8 Time: 0.00493367
[01/01/2022-16:13:46] [V] [TRT] Setting a default quantization params because quantization data is missing for 
[01/01/2022-16:13:46] [V] [TRT] Tactic: 0x00000000000003ea Time: 0.0130323
[01/01/2022-16:13:46] [V] [TRT] Setting a default quantization params because quantization data is missing for 
[01/01/2022-16:13:46] [V] [TRT] Tactic: 0x0000000000000000 Time: 0.00464678
[01/01/2022-16:13:46] [V] [TRT] Fastest Tactic: 0x0000000000000000 Time: 0.00464678
[01/01/2022-16:13:46] [V] [TRT] *************** Autotuning Reformat: Half(3136,784:2,28,1) -> Half(784,1:8,28,1) ***************
[01/01/2022-16:13:46] [V] [TRT] --------------- Timing Runner: Optimizer Reformat(ReLU32_Output_0 -> <out>) (Reformat)
[01/01/2022-16:13:46] [V] [TRT] Setting a default quantization params because quantization data is missing for 
[01/01/2022-16:13:46] [V] [TRT] Tactic: 0x00000000000003e8 Time: 0.00490819
[01/01/2022-16:13:46] [V] [TRT] Setting a default quantization params because quantization data is missing for 
[01/01/2022-16:13:46] [V] [TRT] Tactic: 0x00000000000003ea Time: 0.0115671
[01/01/2022-16:13:46] [V] [TRT] Setting a default quantization params because quantization data is missing for 
[01/01/2022-16:13:46] [V] [TRT] Tactic: 0x0000000000000000 Time: 0.00429647
[01/01/2022-16:13:46] [V] [TRT] Fastest Tactic: 0x0000000000000000 Time: 0.00429647
[01/01/2022-16:13:46] [V] [TRT] *************** Autotuning Reformat: Half(3136,784:2,28,1) -> Int8(1568,784:4,28,1) ***************
[01/01/2022-16:13:46] [V] [TRT] --------------- Timing Runner: Optimizer Reformat(ReLU32_Output_0 -> <out>) (Reformat)
[01/01/2022-16:13:46] [V] [TRT] Setting a default quantization params because quantization data is missing for 
[01/01/2022-16:13:46] [V] [TRT] Tactic: 0x00000000000003e8 Time: 0.00518008
[01/01/2022-16:13:46] [V] [TRT] Setting a default quantization params because quantization data is missing for 
[01/01/2022-16:13:46] [V] [TRT] Tactic: 0x00000000000003ea Time: 0.0122518
[01/01/2022-16:13:46] [V] [TRT] Setting a default quantization params because quantization data is missing for 
[01/01/2022-16:13:46] [V] [TRT] Tactic: 0x0000000000000000 Time: 0.00519673
[01/01/2022-16:13:46] [V] [TRT] Fastest Tactic: 0x00000000000003e8 Time: 0.00518008
[01/01/2022-16:13:46] [V] [TRT] *************** Autotuning Reformat: Half(3136,784:2,28,1) -> Int8(784,784:32,28,1) ***************
[01/01/2022-16:13:46] [V] [TRT] --------------- Timing Runner: Optimizer Reformat(ReLU32_Output_0 -> <out>) (Reformat)
[01/01/2022-16:13:46] [V] [TRT] Setting a default quantization params because quantization data is missing for 
[01/01/2022-16:13:46] [V] [TRT] Tactic: 0x00000000000003e8 Time: 0.00714743
[01/01/2022-16:13:46] [V] [TRT] Setting a default quantization params because quantization data is missing for 
[01/01/2022-16:13:46] [V] [TRT] Tactic: 0x00000000000003ea Time: 0.012373
[01/01/2022-16:13:46] [V] [TRT] Setting a default quantization params because quantization data is missing for 
[01/01/2022-16:13:46] [V] [TRT] Tactic: 0x0000000000000000 Time: 0.00709333
[01/01/2022-16:13:46] [V] [TRT] Fastest Tactic: 0x0000000000000000 Time: 0.00709333
[01/01/2022-16:13:46] [V] [TRT] *************** Autotuning Reformat: Half(1568,1:4,56,2) -> Float(6272,784,28,1) ***************
[01/01/2022-16:13:46] [V] [TRT] --------------- Timing Runner: Optimizer Reformat(ReLU32_Output_0 -> <out>) (Reformat)
[01/01/2022-16:13:46] [V] [TRT] Setting a default quantization params because quantization data is missing for 
[01/01/2022-16:13:46] [V] [TRT] Tactic: 0x00000000000003e8 Time: 0.00513633
[01/01/2022-16:13:46] [V] [TRT] Setting a default quantization params because quantization data is missing for 
[01/01/2022-16:13:46] [V] [TRT] Tactic: 0x00000000000003ea Time: 0.0130128
[01/01/2022-16:13:46] [V] [TRT] Setting a default quantization params because quantization data is missing for 
[01/01/2022-16:13:46] [V] [TRT] Tactic: 0x0000000000000000 Time: 0.00517094
[01/01/2022-16:13:46] [V] [TRT] Fastest Tactic: 0x00000000000003e8 Time: 0.00513633
[01/01/2022-16:13:46] [V] [TRT] *************** Autotuning Reformat: Half(1568,1:4,56,2) -> Float(1568,1:4,56,2) ***************
[01/01/2022-16:13:46] [V] [TRT] --------------- Timing Runner: Optimizer Reformat(ReLU32_Output_0 -> <out>) (Reformat)
[01/01/2022-16:13:46] [V] [TRT] Setting a default quantization params because quantization data is missing for 
[01/01/2022-16:13:46] [V] [TRT] Tactic: 0x00000000000003e8 Time: 0.00529535
[01/01/2022-16:13:46] [V] [TRT] Setting a default quantization params because quantization data is missing for 
[01/01/2022-16:13:46] [V] [TRT] Tactic: 0x00000000000003ea Time: 0.0134392
[01/01/2022-16:13:46] [V] [TRT] Setting a default quantization params because quantization data is missing for 
[01/01/2022-16:13:46] [V] [TRT] Tactic: 0x0000000000000000 Time: 0.00539124
[01/01/2022-16:13:46] [V] [TRT] Fastest Tactic: 0x00000000000003e8 Time: 0.00529535
[01/01/2022-16:13:46] [V] [TRT] *************** Autotuning Reformat: Half(1568,1:4,56,2) -> Half(6272,784,28,1) ***************
[01/01/2022-16:13:46] [V] [TRT] --------------- Timing Runner: Optimizer Reformat(ReLU32_Output_0 -> <out>) (Reformat)
[01/01/2022-16:13:46] [V] [TRT] Setting a default quantization params because quantization data is missing for 
[01/01/2022-16:13:46] [V] [TRT] Tactic: 0x00000000000003e8 Time: 0.00546269
[01/01/2022-16:13:46] [V] [TRT] Setting a default quantization params because quantization data is missing for 
[01/01/2022-16:13:46] [V] [TRT] Tactic: 0x00000000000003ea Time: 0.0135177
[01/01/2022-16:13:46] [V] [TRT] Setting a default quantization params because quantization data is missing for 
[01/01/2022-16:13:46] [V] [TRT] Tactic: 0x0000000000000000 Time: 0.0056684
[01/01/2022-16:13:46] [V] [TRT] Fastest Tactic: 0x00000000000003e8 Time: 0.00546269
[01/01/2022-16:13:46] [V] [TRT] *************** Autotuning Reformat: Half(1568,1:4,56,2) -> Half(3136,784:2,28,1) ***************
[01/01/2022-16:13:46] [V] [TRT] --------------- Timing Runner: Optimizer Reformat(ReLU32_Output_0 -> <out>) (Reformat)
[01/01/2022-16:13:46] [V] [TRT] Setting a default quantization params because quantization data is missing for 
[01/01/2022-16:13:46] [V] [TRT] Tactic: 0x00000000000003e8 Time: 0.00500981
[01/01/2022-16:13:46] [V] [TRT] Setting a default quantization params because quantization data is missing for 
[01/01/2022-16:13:46] [V] [TRT] Tactic: 0x00000000000003ea Time: 0.0121333
[01/01/2022-16:13:46] [V] [TRT] Setting a default quantization params because quantization data is missing for 
[01/01/2022-16:13:46] [V] [TRT] Tactic: 0x0000000000000000 Time: 0.00506325
[01/01/2022-16:13:46] [V] [TRT] Fastest Tactic: 0x00000000000003e8 Time: 0.00500981
[01/01/2022-16:13:46] [V] [TRT] *************** Autotuning Reformat: Half(1568,1:4,56,2) -> Half(784,1:8,28,1) ***************
[01/01/2022-16:13:46] [V] [TRT] --------------- Timing Runner: Optimizer Reformat(ReLU32_Output_0 -> <out>) (Reformat)
[01/01/2022-16:13:46] [V] [TRT] Setting a default quantization params because quantization data is missing for 
[01/01/2022-16:13:46] [V] [TRT] Tactic: 0x00000000000003e8 Time: 0.00510566
[01/01/2022-16:13:46] [V] [TRT] Setting a default quantization params because quantization data is missing for 
[01/01/2022-16:13:46] [V] [TRT] Tactic: 0x00000000000003ea Time: 0.0126979
[01/01/2022-16:13:46] [V] [TRT] Setting a default quantization params because quantization data is missing for 
[01/01/2022-16:13:46] [V] [TRT] Tactic: 0x0000000000000000 Time: 0.00505616
[01/01/2022-16:13:46] [V] [TRT] Fastest Tactic: 0x0000000000000000 Time: 0.00505616
[01/01/2022-16:13:46] [V] [TRT] *************** Autotuning Reformat: Half(1568,1:4,56,2) -> Int8(1568,784:4,28,1) ***************
[01/01/2022-16:13:46] [V] [TRT] --------------- Timing Runner: Optimizer Reformat(ReLU32_Output_0 -> <out>) (Reformat)
[01/01/2022-16:13:46] [V] [TRT] Setting a default quantization params because quantization data is missing for 
[01/01/2022-16:13:46] [V] [TRT] Tactic: 0x00000000000003e8 Time: 0.00546743
[01/01/2022-16:13:46] [V] [TRT] Setting a default quantization params because quantization data is missing for 
[01/01/2022-16:13:46] [V] [TRT] Tactic: 0x00000000000003ea Time: 0.0128389
[01/01/2022-16:13:46] [V] [TRT] Setting a default quantization params because quantization data is missing for 
[01/01/2022-16:13:46] [V] [TRT] Tactic: 0x0000000000000000 Time: 0.00545693
[01/01/2022-16:13:46] [V] [TRT] Fastest Tactic: 0x0000000000000000 Time: 0.00545693
[01/01/2022-16:13:46] [V] [TRT] *************** Autotuning Reformat: Half(1568,1:4,56,2) -> Int8(784,784:32,28,1) ***************
[01/01/2022-16:13:46] [V] [TRT] --------------- Timing Runner: Optimizer Reformat(ReLU32_Output_0 -> <out>) (Reformat)
[01/01/2022-16:13:46] [V] [TRT] Setting a default quantization params because quantization data is missing for 
[01/01/2022-16:13:46] [V] [TRT] Tactic: 0x00000000000003e8 Time: 0.00768409
[01/01/2022-16:13:46] [V] [TRT] Setting a default quantization params because quantization data is missing for 
[01/01/2022-16:13:46] [V] [TRT] Tactic: 0x00000000000003ea Time: 0.0128267
[01/01/2022-16:13:46] [V] [TRT] Setting a default quantization params because quantization data is missing for 
[01/01/2022-16:13:46] [V] [TRT] Tactic: 0x0000000000000000 Time: 0.00781113
[01/01/2022-16:13:46] [V] [TRT] Fastest Tactic: 0x00000000000003e8 Time: 0.00768409
[01/01/2022-16:13:46] [V] [TRT] *************** Autotuning Reformat: Half(784,1:8,28,1) -> Float(6272,784,28,1) ***************
[01/01/2022-16:13:46] [V] [TRT] --------------- Timing Runner: Optimizer Reformat(ReLU32_Output_0 -> <out>) (Reformat)
[01/01/2022-16:13:46] [V] [TRT] Setting a default quantization params because quantization data is missing for 
[01/01/2022-16:13:46] [V] [TRT] Tactic: 0x00000000000003e8 Time: 0.0049123
[01/01/2022-16:13:46] [V] [TRT] Setting a default quantization params because quantization data is missing for 
[01/01/2022-16:13:46] [V] [TRT] Tactic: 0x00000000000003ea Time: 0.0120648
[01/01/2022-16:13:46] [V] [TRT] Setting a default quantization params because quantization data is missing for 
[01/01/2022-16:13:46] [V] [TRT] Tactic: 0x0000000000000000 Time: 0.00456043
[01/01/2022-16:13:46] [V] [TRT] Fastest Tactic: 0x0000000000000000 Time: 0.00456043
[01/01/2022-16:13:46] [V] [TRT] *************** Autotuning Reformat: Half(784,1:8,28,1) -> Float(1568,1:4,56,2) ***************
[01/01/2022-16:13:46] [V] [TRT] --------------- Timing Runner: Optimizer Reformat(ReLU32_Output_0 -> <out>) (Reformat)
[01/01/2022-16:13:46] [V] [TRT] Setting a default quantization params because quantization data is missing for 
[01/01/2022-16:13:46] [V] [TRT] Tactic: 0x00000000000003e8 Time: 0.00515902
[01/01/2022-16:13:46] [V] [TRT] Setting a default quantization params because quantization data is missing for 
[01/01/2022-16:13:46] [V] [TRT] Tactic: 0x00000000000003ea Time: 0.0128518
[01/01/2022-16:13:46] [V] [TRT] Setting a default quantization params because quantization data is missing for 
[01/01/2022-16:13:46] [V] [TRT] Tactic: 0x0000000000000000 Time: 0.00523967
[01/01/2022-16:13:46] [V] [TRT] Fastest Tactic: 0x00000000000003e8 Time: 0.00515902
[01/01/2022-16:13:46] [V] [TRT] *************** Autotuning Reformat: Half(784,1:8,28,1) -> Half(6272,784,28,1) ***************
[01/01/2022-16:13:46] [V] [TRT] --------------- Timing Runner: Optimizer Reformat(ReLU32_Output_0 -> <out>) (Reformat)
[01/01/2022-16:13:46] [V] [TRT] Setting a default quantization params because quantization data is missing for 
[01/01/2022-16:13:46] [V] [TRT] Tactic: 0x00000000000003e8 Time: 0.00538362
[01/01/2022-16:13:46] [V] [TRT] Setting a default quantization params because quantization data is missing for 
[01/01/2022-16:13:46] [V] [TRT] Tactic: 0x00000000000003ea Time: 0.0131445
[01/01/2022-16:13:46] [V] [TRT] Setting a default quantization params because quantization data is missing for 
[01/01/2022-16:13:46] [V] [TRT] Tactic: 0x0000000000000000 Time: 0.00497545
[01/01/2022-16:13:46] [V] [TRT] Fastest Tactic: 0x0000000000000000 Time: 0.00497545
[01/01/2022-16:13:46] [V] [TRT] *************** Autotuning Reformat: Half(784,1:8,28,1) -> Half(3136,784:2,28,1) ***************
[01/01/2022-16:13:46] [V] [TRT] --------------- Timing Runner: Optimizer Reformat(ReLU32_Output_0 -> <out>) (Reformat)
[01/01/2022-16:13:46] [V] [TRT] Setting a default quantization params because quantization data is missing for 
[01/01/2022-16:13:46] [V] [TRT] Tactic: 0x00000000000003e8 Time: 0.00487878
[01/01/2022-16:13:46] [V] [TRT] Setting a default quantization params because quantization data is missing for 
[01/01/2022-16:13:46] [V] [TRT] Tactic: 0x00000000000003ea Time: 0.0118516
[01/01/2022-16:13:46] [V] [TRT] Setting a default quantization params because quantization data is missing for 
[01/01/2022-16:13:46] [V] [TRT] Tactic: 0x0000000000000000 Time: 0.00438746
[01/01/2022-16:13:46] [V] [TRT] Fastest Tactic: 0x0000000000000000 Time: 0.00438746
[01/01/2022-16:13:46] [V] [TRT] *************** Autotuning Reformat: Half(784,1:8,28,1) -> Int8(1568,784:4,28,1) ***************
[01/01/2022-16:13:46] [V] [TRT] --------------- Timing Runner: Optimizer Reformat(ReLU32_Output_0 -> <out>) (Reformat)
[01/01/2022-16:13:46] [V] [TRT] Setting a default quantization params because quantization data is missing for 
[01/01/2022-16:13:46] [V] [TRT] Tactic: 0x00000000000003e8 Time: 0.00538209
[01/01/2022-16:13:46] [V] [TRT] Setting a default quantization params because quantization data is missing for 
[01/01/2022-16:13:46] [V] [TRT] Tactic: 0x00000000000003ea Time: 0.0129756
[01/01/2022-16:13:46] [V] [TRT] Setting a default quantization params because quantization data is missing for 
[01/01/2022-16:13:46] [V] [TRT] Tactic: 0x0000000000000000 Time: 0.00550646
[01/01/2022-16:13:46] [V] [TRT] Fastest Tactic: 0x00000000000003e8 Time: 0.00538209
[01/01/2022-16:13:46] [V] [TRT] *************** Autotuning Reformat: Half(784,1:8,28,1) -> Int8(784,784:32,28,1) ***************
[01/01/2022-16:13:46] [V] [TRT] --------------- Timing Runner: Optimizer Reformat(ReLU32_Output_0 -> <out>) (Reformat)
[01/01/2022-16:13:46] [V] [TRT] Setting a default quantization params because quantization data is missing for 
[01/01/2022-16:13:46] [V] [TRT] Tactic: 0x00000000000003e8 Time: 0.00760998
[01/01/2022-16:13:46] [V] [TRT] Setting a default quantization params because quantization data is missing for 
[01/01/2022-16:13:46] [V] [TRT] Tactic: 0x00000000000003ea Time: 0.0130718
[01/01/2022-16:13:46] [V] [TRT] Setting a default quantization params because quantization data is missing for 
[01/01/2022-16:13:46] [V] [TRT] Tactic: 0x0000000000000000 Time: 0.00760614
[01/01/2022-16:13:46] [V] [TRT] Fastest Tactic: 0x0000000000000000 Time: 0.00760614
[01/01/2022-16:13:46] [V] [TRT] *************** Autotuning Reformat: Half(784,784:32,28,1) -> Float(6272,784,28,1) ***************
[01/01/2022-16:13:46] [V] [TRT] --------------- Timing Runner: Optimizer Reformat(ReLU32_Output_0 -> <out>) (Reformat)
[01/01/2022-16:13:46] [V] [TRT] Setting a default quantization params because quantization data is missing for 
[01/01/2022-16:13:46] [V] [TRT] Tactic: 0x00000000000003e8 Time: 0.00545693
[01/01/2022-16:13:46] [V] [TRT] Setting a default quantization params because quantization data is missing for 
[01/01/2022-16:13:46] [V] [TRT] Tactic: 0x00000000000003ea Time: 0.0126758
[01/01/2022-16:13:46] [V] [TRT] Setting a default quantization params because quantization data is missing for 
[01/01/2022-16:13:46] [V] [TRT] Tactic: 0x0000000000000000 Time: 0.00547894
[01/01/2022-16:13:46] [V] [TRT] Fastest Tactic: 0x00000000000003e8 Time: 0.00545693
[01/01/2022-16:13:46] [V] [TRT] *************** Autotuning Reformat: Half(784,784:32,28,1) -> Float(1568,1:4,56,2) ***************
[01/01/2022-16:13:46] [V] [TRT] --------------- Timing Runner: Optimizer Reformat(ReLU32_Output_0 -> <out>) (Reformat)
[01/01/2022-16:13:46] [V] [TRT] Setting a default quantization params because quantization data is missing for 
[01/01/2022-16:13:46] [V] [TRT] Tactic: 0x00000000000003e8 Time: 0.00550892
[01/01/2022-16:13:46] [V] [TRT] Setting a default quantization params because quantization data is missing for 
[01/01/2022-16:13:46] [V] [TRT] Tactic: 0x00000000000003ea Time: 0.0124164
[01/01/2022-16:13:46] [V] [TRT] Setting a default quantization params because quantization data is missing for 
[01/01/2022-16:13:46] [V] [TRT] Tactic: 0x0000000000000000 Time: 0.00531369
[01/01/2022-16:13:46] [V] [TRT] Fastest Tactic: 0x0000000000000000 Time: 0.00531369
[01/01/2022-16:13:46] [V] [TRT] *************** Autotuning Reformat: Half(784,784:32,28,1) -> Half(6272,784,28,1) ***************
[01/01/2022-16:13:46] [V] [TRT] --------------- Timing Runner: Optimizer Reformat(ReLU32_Output_0 -> <out>) (Reformat)
[01/01/2022-16:13:46] [V] [TRT] Setting a default quantization params because quantization data is missing for 
[01/01/2022-16:13:46] [V] [TRT] Tactic: 0x00000000000003e8 Time: 0.00545321
[01/01/2022-16:13:46] [V] [TRT] Setting a default quantization params because quantization data is missing for 
[01/01/2022-16:13:46] [V] [TRT] Tactic: 0x00000000000003ea Time: 0.013302
[01/01/2022-16:13:46] [V] [TRT] Setting a default quantization params because quantization data is missing for 
[01/01/2022-16:13:46] [V] [TRT] Tactic: 0x0000000000000000 Time: 0.00545405
[01/01/2022-16:13:46] [V] [TRT] Fastest Tactic: 0x00000000000003e8 Time: 0.00545321
[01/01/2022-16:13:46] [V] [TRT] *************** Autotuning Reformat: Half(784,784:32,28,1) -> Half(3136,784:2,28,1) ***************
[01/01/2022-16:13:46] [V] [TRT] --------------- Timing Runner: Optimizer Reformat(ReLU32_Output_0 -> <out>) (Reformat)
[01/01/2022-16:13:46] [V] [TRT] Setting a default quantization params because quantization data is missing for 
[01/01/2022-16:13:46] [V] [TRT] Tactic: 0x00000000000003e8 Time: 0.00497608
[01/01/2022-16:13:46] [V] [TRT] Setting a default quantization params because quantization data is missing for 
[01/01/2022-16:13:46] [V] [TRT] Tactic: 0x00000000000003ea Time: 0.0124971
[01/01/2022-16:13:46] [V] [TRT] Setting a default quantization params because quantization data is missing for 
[01/01/2022-16:13:46] [V] [TRT] Tactic: 0x0000000000000000 Time: 0.00493572
[01/01/2022-16:13:46] [V] [TRT] Fastest Tactic: 0x0000000000000000 Time: 0.00493572
[01/01/2022-16:13:46] [V] [TRT] *************** Autotuning Reformat: Half(784,784:32,28,1) -> Half(784,1:8,28,1) ***************
[01/01/2022-16:13:46] [V] [TRT] --------------- Timing Runner: Optimizer Reformat(ReLU32_Output_0 -> <out>) (Reformat)
[01/01/2022-16:13:46] [V] [TRT] Setting a default quantization params because quantization data is missing for 
[01/01/2022-16:13:46] [V] [TRT] Tactic: 0x00000000000003e8 Time: 0.00489402
[01/01/2022-16:13:46] [V] [TRT] Setting a default quantization params because quantization data is missing for 
[01/01/2022-16:13:46] [V] [TRT] Tactic: 0x00000000000003ea Time: 0.012341
[01/01/2022-16:13:46] [V] [TRT] Setting a default quantization params because quantization data is missing for 
[01/01/2022-16:13:46] [V] [TRT] Tactic: 0x0000000000000000 Time: 0.00500855
[01/01/2022-16:13:46] [V] [TRT] Fastest Tactic: 0x00000000000003e8 Time: 0.00489402
[01/01/2022-16:13:46] [V] [TRT] *************** Autotuning Reformat: Half(784,784:32,28,1) -> Int8(1568,784:4,28,1) ***************
[01/01/2022-16:13:46] [V] [TRT] --------------- Timing Runner: Optimizer Reformat(ReLU32_Output_0 -> <out>) (Reformat)
[01/01/2022-16:13:46] [V] [TRT] Setting a default quantization params because quantization data is missing for 
[01/01/2022-16:13:46] [V] [TRT] Tactic: 0x00000000000003e8 Time: 0.00530133
[01/01/2022-16:13:46] [V] [TRT] Setting a default quantization params because quantization data is missing for 
[01/01/2022-16:13:46] [V] [TRT] Tactic: 0x00000000000003ea Time: 0.0127181
[01/01/2022-16:13:46] [V] [TRT] Setting a default quantization params because quantization data is missing for 
[01/01/2022-16:13:46] [V] [TRT] Tactic: 0x0000000000000000 Time: 0.00544677
[01/01/2022-16:13:46] [V] [TRT] Fastest Tactic: 0x00000000000003e8 Time: 0.00530133
[01/01/2022-16:13:46] [V] [TRT] *************** Autotuning Reformat: Half(784,784:32,28,1) -> Int8(784,784:32,28,1) ***************
[01/01/2022-16:13:46] [V] [TRT] --------------- Timing Runner: Optimizer Reformat(ReLU32_Output_0 -> <out>) (Reformat)
[01/01/2022-16:13:46] [V] [TRT] Setting a default quantization params because quantization data is missing for 
[01/01/2022-16:13:46] [V] [TRT] Tactic: 0x00000000000003e8 Time: 0.00663958
[01/01/2022-16:13:46] [V] [TRT] Setting a default quantization params because quantization data is missing for 
[01/01/2022-16:13:46] [V] [TRT] Tactic: 0x00000000000003ea Time: 0.0129349
[01/01/2022-16:13:46] [V] [TRT] Setting a default quantization params because quantization data is missing for 
[01/01/2022-16:13:46] [V] [TRT] Tactic: 0x0000000000000000 Time: 0.00722743
[01/01/2022-16:13:46] [V] [TRT] Fastest Tactic: 0x00000000000003e8 Time: 0.00663958
[01/01/2022-16:13:46] [V] [TRT] *************** Autotuning Reformat: Int8(6272,784,28,1) -> Float(6272,784,28,1) ***************
[01/01/2022-16:13:46] [V] [TRT] --------------- Timing Runner: Optimizer Reformat(ReLU32_Output_0 -> <out>) (Reformat)
[01/01/2022-16:13:46] [V] [TRT] Setting a default quantization params because quantization data is missing for 
[01/01/2022-16:13:46] [V] [TRT] Tactic: 0x00000000000003e8 Time: 0.00482849
[01/01/2022-16:13:46] [V] [TRT] Setting a default quantization params because quantization data is missing for 
[01/01/2022-16:13:46] [V] [TRT] Tactic: 0x00000000000003ea Time: 0.0133286
[01/01/2022-16:13:46] [V] [TRT] Setting a default quantization params because quantization data is missing for 
[01/01/2022-16:13:46] [V] [TRT] Tactic: 0x0000000000000000 Time: 0.00499626
[01/01/2022-16:13:46] [V] [TRT] Fastest Tactic: 0x00000000000003e8 Time: 0.00482849
[01/01/2022-16:13:46] [V] [TRT] *************** Autotuning Reformat: Int8(6272,784,28,1) -> Float(1568,1:4,56,2) ***************
[01/01/2022-16:13:46] [V] [TRT] --------------- Timing Runner: Optimizer Reformat(ReLU32_Output_0 -> <out>) (Reformat)
[01/01/2022-16:13:46] [V] [TRT] Setting a default quantization params because quantization data is missing for 
[01/01/2022-16:13:46] [V] [TRT] Tactic: 0x00000000000003e8 Time: 0.00535704
[01/01/2022-16:13:46] [V] [TRT] Setting a default quantization params because quantization data is missing for 
[01/01/2022-16:13:46] [V] [TRT] Tactic: 0x00000000000003ea Time: 0.0127771
[01/01/2022-16:13:46] [V] [TRT] Setting a default quantization params because quantization data is missing for 
[01/01/2022-16:13:46] [V] [TRT] Tactic: 0x0000000000000000 Time: 0.00550664
[01/01/2022-16:13:46] [V] [TRT] Fastest Tactic: 0x00000000000003e8 Time: 0.00535704
[01/01/2022-16:13:46] [V] [TRT] *************** Autotuning Reformat: Int8(6272,784,28,1) -> Half(6272,784,28,1) ***************
[01/01/2022-16:13:46] [V] [TRT] --------------- Timing Runner: Optimizer Reformat(ReLU32_Output_0 -> <out>) (Reformat)
[01/01/2022-16:13:46] [V] [TRT] Setting a default quantization params because quantization data is missing for 
[01/01/2022-16:13:46] [V] [TRT] Tactic: 0x00000000000003e8 Time: 0.00508516
[01/01/2022-16:13:46] [V] [TRT] Setting a default quantization params because quantization data is missing for 
[01/01/2022-16:13:46] [V] [TRT] Tactic: 0x00000000000003ea Time: 0.0126739
[01/01/2022-16:13:46] [V] [TRT] Setting a default quantization params because quantization data is missing for 
[01/01/2022-16:13:46] [V] [TRT] Tactic: 0x0000000000000000 Time: 0.00541596
[01/01/2022-16:13:46] [V] [TRT] Fastest Tactic: 0x00000000000003e8 Time: 0.00508516
[01/01/2022-16:13:46] [V] [TRT] *************** Autotuning Reformat: Int8(6272,784,28,1) -> Half(3136,784:2,28,1) ***************
[01/01/2022-16:13:46] [V] [TRT] --------------- Timing Runner: Optimizer Reformat(ReLU32_Output_0 -> <out>) (Reformat)
[01/01/2022-16:13:46] [V] [TRT] Setting a default quantization params because quantization data is missing for 
[01/01/2022-16:13:46] [V] [TRT] Tactic: 0x00000000000003e8 Time: 0.00508532
